{
  "protocol_version": "1.0.0",
  "run_id": "run-bugfix",
  "run_status": "complete",
  "goal": "Fix null pointer exception in user authentication module",
  "result": "Added null check before accessing user profile; added unit test coverage",
  "execution_mode": "standard",
  "fix_cycles_used": 1,
  "changes": [
    "Added null guard in auth.js getUserProfile function",
    "Added null input handling"
  ],
  "evidence_refs": [
    "ev-cmd-001",
    "ev-file-001"
  ],
  "verification": [
    "Manual code review confirms null guard is in place"
  ],
  "limitations": [
    "Edge case for empty string usernames not covered"
  ],
  "files_affected": [
    "src/auth.js",
    "tests/auth.test.js"
  ],
  "sentinel_verdict": "PASS_WITH_LIMITATIONS",
  "completed_at": "2026-07-20T10:30:00Z"
}
