{
  "protocol_version": "1.0.0",
  "run_id": "run-001",
  "run_status": "complete",
  "goal": "Fix null pointer exception in login flow",
  "result": "Successfully fixed the null pointer exception by adding null guards in AuthService and input validation in LoginController. All 142 tests pass.",
  "execution_mode": "standard",
  "fix_cycles_used": 1,
  "changes": [
    "Added null parameter check in AuthService.authenticate()",
    "Added input validation in LoginController.login()",
    "Added unit check for null input edge case"
  ],
  "evidence_refs": [
    "ev-cmd-004",
    "ev-approval-001",
    "ev-file-003",
    "ev-file-004"
  ],
  "verification": [
    "All 142 unit checks pass",
    "Code review approved by senior engineer",
    "CI pipeline passed"
  ],
  "limitations": [
    "Input validation only covers null case, additional sanitization may be needed"
  ],
  "files_affected": [
    "src/main/java/com/app/auth/AuthService.java",
    "src/main/java/com/app/controller/LoginController.java",
    "src/test/java/com/app/auth/AuthServiceTest.java"
  ],
  "sentinel_verdict": "PASS",
  "completed_at": "2026-07-20T10:15:00Z"
}
