{
  "protocol_version": "1.0.0",
  "run_id": "run-blocked",
  "run_status": "blocked",
  "goal": "Deploy application to staging environment",
  "result": "Action blocked: SSH deploy key not found in credential store",
  "execution_mode": "standard",
  "fix_cycles_used": 0,
  "changes": [],
  "evidence_refs": [],
  "verification": [],
  "limitations": [
    "SSH deploy key is missing or expired",
    "Cannot proceed with deployment without valid credentials"
  ],
  "files_affected": [],
  "sentinel_verdict": "BLOCKED",
  "completed_at": "2026-07-20T12:00:00Z"
}
