{
  "protocol_version": "1.0.0",
  "run_id": "run-quick-readme",
  "run_status": "complete",
  "goal": "Fix spelling error in README.md documentation",
  "result": "Corrected 'teh' to 'the' in README.md line 42",
  "execution_mode": "quick",
  "fix_cycles_used": 0,
  "changes": [
    "Fixed typo in README.md"
  ],
  "evidence_refs": [
    "ev-cmd-001"
  ],
  "verification": [
    "grep -c 'teh' README.md returns 0"
  ],
  "limitations": [],
  "files_affected": [
    "README.md"
  ],
  "sentinel_verdict": "PASS",
  "completed_at": "2026-07-20T10:05:00Z"
}
