{
  "protocol_version": "1.0.0",
  "run_id": "run-audit",
  "run_status": "complete",
  "goal": "Audit dependency security and configuration for production readiness",
  "result": "Identified 3 outdated dependencies and 1 misconfigured CSP header; no changes applied",
  "execution_mode": "audit",
  "fix_cycles_used": 0,
  "changes": [],
  "evidence_refs": [
    "ev-cmd-001",
    "ev-cmd-002"
  ],
  "verification": [
    "Audit findings documented in audit-log.md"
  ],
  "limitations": [
    "No source changes were made during this audit",
    "Findings require manual review by the security team"
  ],
  "files_affected": [],
  "sentinel_verdict": "PASS_WITH_LIMITATIONS",
  "completed_at": "2026-07-20T11:00:00Z"
}
